label,message
"Just wanted to say thanks for your help yesterday. Couldn't have done it without you!",ham
"Battery about to die. Call you when I get home.",ham
"The meeting with the client went really well. They signed the contract!",ham
"Can you please bring my jacket? I left it at your place yesterday",ham
"We're out of dog food. Can you grab some on your way home?",ham
"Hey, just a heads-up, meeting moved to 2 PM today.",ham
"Grocery list: milk, bread, eggs. Don't forget!",ham
"Car's fixed! Ready to go whenever you are.",ham
"Happy birthday! Hope you have a great day!",ham
"Running late, be there in 15 mins.",ham
"Dinner plans tonight?",ham
"Appointment confirmed for tomorrow at 10 AM.",ham
"Weather's looking good for a walk later.",ham
"Did you remember to lock the door?",ham
"Need help with anything?",ham
"Almost there, traffic is a nightmare!",ham
"See you later!",ham
"Reminder: Bill due next week.",ham
"Just arrived. Where are you?",ham
"Call me when you get a chance.",ham
"Checked your proposal, looks great!",ham
"What time is dinner?",ham